[
  {
    "First Name": "Eduardo",
    "Last Name": "Diaz Sancha",
    "Former Job Title": "Director of Engineering, Post Purchase Technology",
    "Function": "Engineering",
    "Location": "Atlanta, GA",
    "LinkedIn URL": "https://www.linkedin.com/in/edsancha",
    "Description": "Engineering leader with 20+ years in consumer product engineering and platform modernization. At Grubhub, led Post Purchase and customer-care engineering across 30+ services and applications, partnered with a 40+ person Product/Design/Engineering group, and previously managed three product-engineering teams totaling up to 36 people, including engineering managers. Led AI-enabled customer-care and AI-assisted software development improvements. VP-level manager-of-managers scope, messaging infrastructure experience, and ability to work in NYC require confirmation."
  }
]
